{
  "content": {
    "digest": "43085c02e220bedf3a7edb089c290c0440a390c6993d3b6530be07ef1af515ae",
    "expanded_bytes": 73322441,
    "files": [
      {
        "bytes": 6624011,
        "path": "ca_model_weights/v_48_002.pt",
        "sha256": "ec038b44a987d7c8351b6ed887c82a2370d54e45e55a6bdaf508a729cef0340e"
      },
      {
        "bytes": 6624011,
        "path": "ca_model_weights/v_48_010.pt",
        "sha256": "cdb50498d45578d20b271fa7817b8cd8bfde3875ad69dbd3f5e4b5dd3e588301"
      },
      {
        "bytes": 6624011,
        "path": "ca_model_weights/v_48_020.pt",
        "sha256": "f28f40170e21858c5ff31ef50b6e63414ff76dc331b19f85aa8586a12031744a"
      },
      {
        "bytes": 6681301,
        "path": "soluble_model_weights/v_48_002.pt",
        "sha256": "0877f840978fe770be6fcec025784d8f50c438571db3260c05e41aa207a7c448"
      },
      {
        "bytes": 6681301,
        "path": "soluble_model_weights/v_48_010.pt",
        "sha256": "79562f7444f72c84595a1c96010713864865a616f4f3967633493041e169fa6e"
      },
      {
        "bytes": 6681301,
        "path": "soluble_model_weights/v_48_020.pt",
        "sha256": "7af52d090172c230c7f0e9d21e02203f6b3a38b16db58d3c7a3960e0a9a6e31a"
      },
      {
        "bytes": 6681301,
        "path": "soluble_model_weights/v_48_030.pt",
        "sha256": "1dd63f1e9fc68a133cc9ef859edf43b489e5ac581cb5624e0b9ec848ff062421"
      },
      {
        "bytes": 6681301,
        "path": "vanilla_model_weights/v_48_002.pt",
        "sha256": "925f2ca1007bf9b02e0e7f420ff00eb91f50fcc2722f64b42e644ae95adaa131"
      },
      {
        "bytes": 6681301,
        "path": "vanilla_model_weights/v_48_010.pt",
        "sha256": "db866fae956a28661f926053d630610c55e9fc4bc03922f2aeeb98a37435ccce"
      },
      {
        "bytes": 6681301,
        "path": "vanilla_model_weights/v_48_020.pt",
        "sha256": "c9cb4a671d79604111231f8dbfc7c590e06f1197453b7a6854ac6661a642f5bd"
      },
      {
        "bytes": 6681301,
        "path": "vanilla_model_weights/v_48_030.pt",
        "sha256": "c34b7bfb38418ea30989fda3314f4781ac4e3920f9825731cf555f1fed44ac66"
      }
    ]
  },
  "entitlement_state": "not-required",
  "kind": "weights",
  "license": {
    "id": "MIT",
    "state": "verified"
  },
  "model_id": "proteinmpnn",
  "owner": "cancer-immunotherapy",
  "retention": "retained-platform",
  "schema": "fs2-serve.nebius.ai/artifact-manifest/v1",
  "source": {
    "revision": "8907e6671bfbfc92303b5f79c4b5e6ce47cdef57",
    "uri": "https://github.com/dauparas/ProteinMPNN"
  }
}
