{"content":{"digest":"967ec99ce70e4e5c1e76fb50d0c51d86e553b299bc798efbfa09daafff9e017a","expanded_bytes":6681301,"files":[{"bytes":6681301,"path":"vanilla_model_weights/v_48_020.pt","sha256":"c9cb4a671d79604111231f8dbfc7c590e06f1197453b7a6854ac6661a642f5bd"}]},"entitlement_state":"not-required","kind":"weights","license":{"id":"MIT","state":"verified"},"model_id":"proteinmpnn","owner":"fs2-serve","retention":"retained-platform","schema":"fs2-serve.nebius.ai/artifact-manifest/v1","source":{"revision":"8907e6671bfbfc92303b5f79c4b5e6ce47cdef57","uri":"https://github.com/dauparas/ProteinMPNN/tree/8907e6671bfbfc92303b5f79c4b5e6ce47cdef57"}}
